Company Name,Capacity Allotted (MT/A),Email Address,Phone Number,Type
"Arihant E Recycling Pvt Ltd, Gut No.307/1, Shahada Road, Dondaicha, Tal. Sindkheda, Dist. Dhule.",2000.0,info@arihantinfo.com,9820350406,Recycler
"WE-The Recycling Company, H. No. 2212, Sr. No. 9-1 N, Behind Essar Petrol Pump, Village Borpada, Tal. Bhiwandi, Dist. Thane",50.0,payalc25@gmail.com,7718824575,Refurbisher
"Techeco E-Waste Namo LLP, Gat No. 155 B/2, Village Dhakambe, Tal. Dindori, Dist. Nashik",9360.0,bhushan@techeco.co.in,9769117070,Recycler
"Threco Recycling LLP, Survey No.
 153-3 & 149-1, Hedavli, Dist- Raigad.",3000.0,karan@threco.com,9820622802,Recycler
"Hi-Tech Recycling (I) Pvt. Ltd, Property No.193, Gat No. 89, Pune- Satara Road, Shindewadi, Tal: Bhor,
 Dist. Pune",1410.0,manish@hitechrecycling.i n,9860602601,Recycler
"Justdispose Recycling Pvt Ltd. (Unit- II), S. No. 42/5, Kaddu Industrial Estate, Sativali Phata, Vasai (E), Tal- Vasai, Dist-Palghar.",1200.0,hemant@justdispose.com,9833030124,Recycler
"E-Incarnation Recycling Pvt. Ltd. Plot No. J-56, MIDC Area, Tarapur, Boiser, Dist: Palghar, Maharashtra",950.0,info@e-incarnation.com,2266251300,Recycler
"Eco Recycling Limited,
 Bldg No. 1, Plot No. 5, S. No. 30B, Village Gokhiware,
 Vasai (E), Tal. Vasai, Dist. Palghar - 401208",18000.0,facility2@ecoreco.com,9920084847,Recycler
"Evergreen Recyclekaro India Pvt.
 Ltd., Gut. No. 113/A, Village Pali, Tal. Wada, Dist. Palghar",7500.0,rajesh@recyclekaro.com,9967310007,Recycler
"Eco Reset Private Limited, Plot No.
 19/1, Mouza Bhowari, Kamptee, Nagpur",10200.0,ecoreset41@gmail.com,7021819071,Recycler
"S V Greentech Private Limited, Gut No. 517/1, & 529, Village: Kelthan Tal. Wada, Dist. Palghar",8500.0,rihanmalik986@gmail.com,9371106436,Recycler
"Global E-Recycling Pvt Ltd., Plot No 2,3,4 Sr No 11 H No 1/1,
 Wakanpada Dhaniv, Palghar",400.0,rahimkhan9833542199@g mail.com,7208644016,Recycler
"Green IT Recycling Center Pvt Ltd, Plot No. D-222, MIDC Ranjangaon, Dist.- Pune - 412209",365.0,rth_raj@hotmail.com,9822356062,Recycler
"Green India E-Waste & Recycling OPC Pvt. Ltd., Survey No. 74, Hissa No. 1/A, House No. 500, Post Dahisar, Dist. Thane.",3000.0,info@gier.co.in,8080414447,Recycler
"Suritex Pvt. Ltd., Plot No. B-111, MIDC Industrial Area, Butibori, District - Nagpur.",2360.0,info@suritex.co.in,9049981347,Recycler
"Green Valley E Waste Management Pvt Ltd, Gut No. 525/10, Village- Ghonsai, Saza-Met, Tal. Wada, Ghonsai, Palghar - 421312",596.0,alam@gvewaste.com,9821021395,Recycler
"Sayma E-Waste Solutions, S. No. 323, Hissa no. 3, A Plot No. B-27, Urali Devashi, Tal. Haveli, Pune",1000.0,saymaewastesolutions@g mail.co m,9922763959,Recycler
"Green Valley E-waste Management Pvt. Ltd., Gut No. 525/10, Village Ghosai, Saza-Met, Tal. Wada, Dist.
 Palghar",596.0,alam@gvewaste.com,9821021395,Recycler
"Western Recycler, Sr. No. 8/2, Plot No. 633, Shilphata, Panvel Road, Dahisar, Tal. & Dist. Thane",400.0,hasimansari229@gmail.co m,9967865052,Recycler
"Tarai Projects Pvt. Ltd., Gut No. 14/1/A, Atar Mala, Near Shivsagar Hotel, Manchar, Tal. Machar, Dist. Pune",560.0,taraiprojects2018@gmail. com,7020687230,Recycler
"Jeenali Trading & Comm. Serv. Pvt. Ltd., Gut No. 68/1, Village Khupri, Tal. Wada, Dist. Palghar",7847.0,millennium005@gmail.co m,9967970333,Recycler
"Unique Recycling, Gut No. 287, At
 Post Nanekarwadi, Tal. Khed, Dist. Pune",180.0,mumatajhmd@gmail.com,9689400817,Recycler
"New India Recyclers
 Plot No. 5 & 6, Gut No. 849/2728, Village Ambethan,
 Tal. Khed, Dist. Pune",150.0,info.newindiarecycle@gm ail.com,8928934040,Recycler
"Electrofine Recycling (OPC) Private Limited,
 Gut No. 386, Village Shindi Khurd, Tal. Maan, Dist. Satara",5000.0,electrofinerecycling@gmai l.com,7397056189,Recycler
"Binbay Recycling Pvt. Ltd., Sr. No. 48, Unit No. 6 & 7, Agarwal Industrial Premises.
 Village Gauripada, Vasai (E), Dist.
 Palghar",3770.0,binbayrecycling@gmail.co m,9819633997,Recycler
"Greenbay Enterprises,
 Shed No. 1, Ground Floor, Ganesh Nagar, Phursungi,
 Katraj Saswad Road, Pune
 Tal. Haveli, Dist. Pune",183.0,egreenbay17@gmail.com,9623300378,Recycler
"Green Life E Waste Recycling Pvt Ltd , Plot No. 11, Gat No. 40, Karodi, Aurangabad,
 Tal. & Dist. Aurangabad",660.0,greenlifeewaste@gmail.co m,8097800830,Recycler
"Bhangarwala Waste Management Pvt Ltd.,
 New S. No. 80/2, Dahisar Mori, Tal. & Dist. Thane",6485.0,bwmgroup23@gmail.com,8655113333,Recycler
"Comnet E-Waste LLP,
 Gut No. 410, At Post Kaudgaon, Tal. & Dist. Ahmednagar",1000.0,pravinhajare@gmail.com,9665520010,Recycler
"Ecolayer E-Waste Recycling,
 S. No. 180/1, Gala No. 2, Opp. Mathura Hotel,
 Village Poman, Tal. Vasai, Dist. Palghar",2000.0,starcomputar22@gmail.co m,9820750836,Recycler
"Bhagyalakshmi Laboratories Limited, Plot No 33,34,35 &36, Shri Shakti Udyog Nagar, Opp St. John College, Veour Village, Palghar, Tal.
 & Dist. Palghar",21000.0,bhagyalakshmi_laboratries @yahoo.com,9820700517,Recycler
"Eco-Recycling Ltd., Eco-House, Near Top Glass Enclave, Bhoipada, Near Range Office, Sativali Road, Vasai (E), Dist. Palghar",7200.0,inspection@ecoreco.com,9867729662,Recycler
"GNR Recycling India Pvt Ltd,
 S. No. 35/4, Dagade Wasti, Pisoli, Pune, Tal. Haveli, Dist. Pune",300.0,lokesh.k@gnrindia.com,9822334823,Recycler
"E-Survival Recycling Private Limited, Gut No. 195/1/B/1, Village Chincholikati, Tal. Mohol, Dist.
 Solapur",33000.0,esurvival2022@gmail.com,9820802032,Recycler
"Green Enviro Management
 Solutions LLP, S. No. 51, Village Kanhe, Tal. Mawal, Dist. Pune",594.0,mail.gps@gmail.com,9766110860,Recycler
"Trans Thane Creek Waste
 Management Association
 P-128, Shil-Mahape Road, Near L&T Infotech, Mahape, Navi Mumbai. Thane",300.0,ttcwmam@gmail.com,9082565312,Recycler
"Mercury Metal Industries (Unit III), Plot No. D-35, Mahad Industrial Area, Mahad, Tal. Mahad, Dist.
 Raigad",200.0,mmimahadd35@gmail.com,9892802451,Recycler
"Aman E-Waste Recyclers Pvt Ltd.,
 S. No. 20/5, Plot No. 79 to 89, Aamgaon,
 Tal. Talasari, Dist. Palghar",10500.0,INFO@AMANRECYCLERS.CO M,9833721472,Recycler
"ECO Friend Industries, Plot No. A- 205, TTC Industrial Area, MIDC Pawane, Navi Mumbai, Tal. & Dist.
 Thane",1240.0,"ingle.mamata@raoagroup
 .com",9821151069,Recycler
"Pune Green Electronic Waste Recycler Pvt. Ltd., S. No. 29/9, Pansare Nagar, Yewlewadi, Pune, Tal. Haveli, Dist. Pune",500.0,"punegreensewaste@gmail
 .com",9922071877,Recycler
"E-Frontline Recycling Pvt. Ltd. Gat No. 183/1, Lokhandwala
 Warehouse, Near Bavi Petrol Pump, Hyderabad Road, At Post Doddi, Tal. South Solapur, Dist. Solapur",40000.0,efrplserver@gmail.com,8980300024,Recycler
"JRS Recycling Solutions Pvt. Ltd. Gala No. 428, S. No. 74, Hissa No. 2A, Garib Nawaz Estate, Old Mumbai Pune Road, Dahisar, Dist. Thane",1044.0,shahid.jrsrecycling@gmail.co m,9004126767,Recycler
"Kuldeep Green Recyclers Private Limited, Survey No. 569-B, Unit- 1/A, At Post Velu, Tal. Bhor, Dist. Pune",1200.0,ewastekuldeep@gmail.com,7733995555,Refurbisher
"Vozon Comsof Pvt Ltd, Sr No 19/9 Indira College Road, Buchade Vasti Road, Tal. Mulshi Dist Pune, Marunji, Pune",5000.0,rajendrakale.vozon@gmail.c om,8600726007,Refurbisher
"J K Corporation,
 Survey No. 242/274, Hissa No. 1 & 2, Vaganpada, Near Nana Steel, Pelhar, Nalasopara (E),
 Tal. Vasai, Dist. Palghar",200.0,j.kcorporation0786@gmail.c om,9769739420,Refurbisher
"Ambar Enterprises,
 S. No. 93, H. No. 1/1/2, Autade Nagar,Handewadi, Pune, Tal. Haveli, Dist. Pune",1000.0,ambarent028@gmail.com,9890812746,Refurbisher
"Kohinoor E-Waste Recycling Pvt. Ltd. Gut No. 205/1 and 205/2, Opp. Gurudatta Washing Centre, Dhekhu, Khalapur, Dist. Raigad",8000.0,kohinoorewasterecycling @gmail.com,9821227048,Refurbisher
"Poona E-Waste Solutions,
 S. No. 322/2, Uruli Devachi, Tal. Haveli, Dist. Pune",250.0,poonaewastesolutions@g mail.co m,8888999362,Refurbisher
"J Choudhary & Company, Sr. No. 67/3, Pipewal Lane Mohammadiya Estate, Pimpri Old Mumbai Pune Road, Pimpri, Thane 400612",500.0,jchoudharyandco@gmail.c om,9869063886,Refurbisher
"E-Refine Corporation, Gut No. 24, Plot No. 2, Dargah Road, Additional Daultabad, Tal. & Dist. Aurangabad",520.0,tapoffice15@gmail.com,9823998866,Refurbisher
"Wonder Print Technologies, Plot No. H-3/16, MIDC Ambad, Nashik, Tal. & Dist. Nashik",375.0,sakaria@wonderprint.in,9373522555,Refurbisher
"Masstech Recycling LLP, Gala no 56, 58, 59 & 82, M.J.K. Compound, Kherani Road, Sakinaka, Mumbai - 400072 - 400072",400.0,bharatscrap07@gmail.co m,9821430755,Refurbisher
"Nasib Scrap Centre, Gat No. 57, At
 Moi Kuruli Chakan, Tal. Khed, Dist. Pune",111.0,rohan91000091@gmail.co m,9890191506,Refurbisher
"Roshani Scrap Center,
 Gut No. 879, Nurani Masjid, Kudalwadi, Chikhali,
 Pune-411062, Tal. Haveli, Dist.
 Pune",200.0,roshaniscrappune@gmail. com,9765615108,Refurbisher
"GNG Electronics Pvt. Ltd.,
 Plot No. Gen-2/1/B, D Block, TTC Industrial Area,
 MIDC Turbhe, Navi Mumbai, Tal. &
 Dist. Thane",1200.0,"vipul.g@electronicsbazaar
 .com",7667568801,Refurbisher
"Diamond Machinery Tools, S. No. 11/30, Gala No. 1372,
 Gausiya Market, Village Pimpri, Tal.
 & Dist. Thane",115.0,mujahidsk@hotmail.com,9869146970,Refurbisher
"New India Recyclers
 Plot No. 5 & 6, Gut No. 849/2728, Village Ambethan,
 Tal. Khed, Dist. Pune",500.0,aslam.quamer@hotmail.c om,9869146970,Refurbisher
"Jai Ambe Enterprises,
 S. No. 80/1, Ekta Kata, Thakurpada, Old M.P. Road, Navi Mumbai, Tal. & Dist. Thane",190.0,jaiambeenterprises48@g mail.com,7710999855,Refurbisher
"Moonlaxmi-E-Waste & Recycling Solutions LLP, Plot No 1125, Sr. No. 15/1/1, Arihant Marg, Near Sukhada Vardha Society, Sukhasagar Nagar, Katraj,
 Pune, Tal. Haveli, Dist. Pune",400.0,ratan@sezindia.co.in,9322251644,Refurbisher
"Big Bull Recyclers Private Limited, Gut No.269/8/2, Village Jawale Kadlag, Tal. Sangamner, Dist.
 Ahmednagar",5100.0,aartirahane414@gmail.co m,8208331808,Refurbisher
"Zakiya Amin Enterprises, Shop No. 8, Noor Apartment, Shreeji Building, Dange Wadi,
 Nalasopara, Tal. & Dist. Palghar",60.0,zakiyaaminent102@gmail. com,9822772102,Refurbisher
"Maharashtra Enterprises Plot No.D-49/2, MIDC Dhule Dist. Dhule",300.0,mahaenter22@gmail.com,9892884231,Refurbisher
"Amin Industries,
 Plot No. C-7/B, MIDC Mirjole, Tal. & Dist. Ratnagiri",200.0,halimshaha6822@gmail.c om,8149127777,Refurbisher
"Erecon Recycling Pvt. Ltd., Gut No. 94, Chitegaon,
 Tal. Paithan, Dist. Aurangabad",500.0,e.recon21@gmail.com,9860579870,Refurbisher
"Go Green E-Recycling,
 Sr. No. 70, Panvel Shil Road, Village Dahisar Pimpri, Tal. & Dist. Thane",300.0,erecyclinggogreen@gmail. com,9833195131,Refurbisher
"Sai Enterprises,
 Plot No. A-8, Gut No. 357/87, Waghjai Nagar, Kharabwadi, Chakan, Tal. Haveli, Dist. Pune",240.0,dinesh_dpn@yahoo.co.in,9881771133,Refurbisher
"Somnath Industries Pvt Ltd..
 OS-56, J Block,,Opp Alpha Foam, Old Landge Kusti Kendra, MIDC Bhosari,
 Tal. Haveli, Dist. Pune",4000.0,somnathindustriespune1 @gmail.com,7558426313,Refurbisher
"Bombay Scrap Traders,
 Gut No. 280, Opp. Indian Petrol Pump, NH-4, Village Sate, Tal. Mawal, Dist. Pune - 412106",1000.0,bombaytraders78@gmail. com,9820294042,Refurbisher
"Afton E-Waste Recycling,
 S. No. 66, Hissa No. 2/2, Gala No. 1, Village Goteghar,
 Janta Market, Near Kashinath Weigh Bridge, Tal. & Dist. Thane",200.0,aftonewasterecycling@gm ail.com,9819399357,Refurbisher
"ASK Steel,
 Gat No. 15, Kudalwadi, Chikhali, Tal. Haveli, Dist. Pune",400.0,asksteel1@gmail.com,8087814368,Refurbisher
"M. S. Malik,
 Plot No. 2/1, 3, 4/1/A, S. No. 5/1, 2, 3/4, Behind Decathlon, Vilholi, Tal. & Dist. Nashik",400.0,m.s.malik1973@gmail.co m,9049049113,Refurbisher
"Aman E-Waste Disposal,
 S. No. 11/12, Shantinagar, Bhosari, Tal. Haveli, Dist. Pune",120.0,amanewastedisposals@g mail.com,8149808801,Refurbisher
"Glacier Waste Management LLP, Plot No. B-49, MIDC Vita, Tal. Miraj. Dist. Sangli",450.0,info.glacier21@gmail.com,9404648183,Refurbisher
"Trishulin Enterprises, Plot No. 42, S. No. 905/1,
 Musalgaon,
 Tal. Sinnar, Dist. Nashik",300.0,aniljoshi008@gmail.com,9760009893,Refurbisher
"Kesariya Metal Conrporation,
 Gat No. 147, Shed No. 1, Mhalunge, Chakan,
 Tal. Khed, Dist. Pune",300.0,kmcpune017@gmail.com,9422459362,Refurbisher
"Raj Enterprises,
 Gut No. 90, At Post Dhakale, Tal. Baramati, Dist. Pune",1113.0,vinodrathi1975@gmail.com,9762777007,Refurbisher
"Imagine Marketing Limited, Warehouse No. 12-B, Mumbai Nashik Highway, Near Padgha Toll Naka, Opp. Urban Tadka, Bhiwandi, Tal. Bhiwandi, Dist. Thane",790.0,jignesh.rambhia@imaginem arketingindia.com,9821038358,Refurbisher
"Shuaib Traders,
 Gat No.669, Jadhavwadi, Chikhali, Pune, Tal. Haveli, Dist. Pune",700.0,afrojsilmane@gmail.com,9588637379,Refurbisher
"Deshwal Waste Management Pvt.
 Ltd., Gut No. 520, Shed-1, Behind Shell Petrol Pump, New Wagholi Road, Wagholi, Tal. Haveli, Dist.
 Pune",1000.0,anillnarang@rediffmail.com,9910055057,Refurbisher
"Dev IT Serv Pvt Ltd,
 Gat No. 520, Shed No. 2, Behind Shell Petrol Pump, New Wagholi Road, Wagholi, Tal. Haveli, Dist. Pune",150.0,sudip.pal@ditserv.com,9910033243,Refurbisher
"Shree Recyclers,S. No. 208-2, At Post Boribadak, Chandanwadi, Tal. Daund, Dist. Pune",180.0,shreerecycler@gmail.com,9822334823,Refurbisher
"Lexim International Pvt. Ltd.
 Plot No. D-192, MIDC Ranjangaon, Tal. Shirur, Dist. Pune",200.0,aditya.s.lolage@gmail.com,9393366060,Refurbisher
"Naaz Trading Company
 Gat No. 66, Dehu Alandi Road, Near Masjid, Chikhali, Tal. Haveli, Dist.
 Pune",180.0,shakilalvi360@gmail.com,8527289786,Refurbisher
"Rajmudra Trading,
 Gat No. 262, Near Waluj Nursery, Village Waluj,
 Tal. Gangapur, Dist. Chatrapati
 Sambhajinagar",250.0,"rajmudratrading2121@gmail
 .com",9923671717 NA,Refurbisher
"V K Metal Corporation Gut No. 433 Part, Usar Tal:- Wada, Dist:- Palghar.",600.0,vkmcpsi2019@gmail.com,9320028491,Refurbisher
"Clean E-waste Recycling, Survey No. 109/2, Richard Compound, Pelhar,Vasai (East), Tal. Vasai, Dist.
 Palghar",100.0,Info@cleanrecycling.in,9833562539,Refurbisher
"Lilashana Sales, Ramdas Company, Nandra Road, Khamgaon, Dist.
 Buldhana",360.0,inglesales007@gmail.com,9850349580,Dismantler
"National Traders, S. No. 103/1/2, Undri-Saswad Road, Autade, Handewadi, Tal. Haveli, Dist. Pune",250.0,national.autade@gmail.com,9850757587,Dismantler
"S. S. E-Waste Recyclers, Gut No.
 442, Village Usar, Kondla Road, Tal. Wada, Dist. Palghar 421312",1500.0,ssewasterecyclers@gmail. com,9022181911,Dismantler
"AG Enterprises, Gat No. 815 (1), Kudalwadi, Chikhali, Pune 411062",365.0,agpune57@gmail.com,9822783051,Dismantler
"Aman Trading Co. F/1, Annasagr Market, Behind Farooqi Hotel, Kurla Andheri Road, Jarimari, Kurla
 (W), Mumbai 400072",100.0,aqtanveer11@gmail.com,9833721472,Dismantler
"Amiable Electroning Pvt. Ltd., Plot No. D-141, Shirawane, TTC Industrial Area, MIDC Shiewane,
 Nerul, Navi Mumbai",750.0,"vipul.g@electronicsbazaar
 .com",7667568801,Dismantler
"E-Recon Recycling Pvt. Ltd., Gut No. 94, Chitegaon, Tal. Paithan, Dist.
 Aurangabad",500.0,e.recon21@gmail.com,9860579870,Dismantler
"Eco Layer E-Waste Recycling, S. No. 11, H. No. 1/1, PT-8, S. K. Indl.
 Estate, Choudhary Compound,
 Vasai E, Palghar",110.0,nafeeshkhan35@gmail.co m,9820750836,Dismantler
"Prabhunath Traders, Sr. No. 314, H.
 No. 2, Uruli Devachi, Tal. Haveli, Dist. Pune",1680.0,scrapcomputer11@gmail. com,9326262223,Dismantler
"Kalawishwa Electrical, B-47 (Sub letting), MIDC Waluj, Dist.
 Aurangabad 431136",300.0,sandeepgore11@yahoo.co m,9225321499,Dismantler
"Royal Scrap Traders, Gut No. 23,
 Plot No. 8, Mayurnagar, Naregaon, Dist. Aurangabad",230.0,omdhoot@gmail.com,7028021132,Dismantler
"Maharashtra Enterprises, Plot No. 17, Rangara Industrial estate, Kiravali (Adivali), Old Thane Pune Road, Tal. Panvel, Dist. Raigad",500.0,mahaenter22@gmail.com,9892884231,Dismantler
"Sigma Enterprises, Plot No. 5 & Gut No. 54/0, Adiwali, Tal. Panvel, Raigad",350.0,abdulwahidkhan1038@g mail.co m,9821751038,Dismantler
"Saani Enterprises, Gut No. 64, Plot No. 65, Mahal Pimpri, Dist.
 Aurangabad",1200.0,shaikhjawed555@gmail.co m,9373301060,Dismantler
"Baban Plastic, Gut No. 1, At.
 Sajapur, Tal. & Dist. Aurangabad 401136",500.0,acc.babanplastic@gmail.c om,9923299786,Dismantler
"Sultan Disposal Stores, S. No. 28/2A/B, Undri, Opp. R Point, Pune Saswad Road, Tal. Haveli, Dist. Pune
 411028",600.0,sultandisposalstores@gma il.com,9822082794,Dismantler
"Indian Scrap Traders, Survey No. 11, Hissa No. 3/A, Ghusia Market, Gala no: 661, Vill: Pimpari, Post Dahisar, Dist: Thane",200.0,indianscrapt@gmail.com,25164797,Dismantler
"Bombay Recyclers Pvt. Ltd., Gala No. P-17-18, S. No. 121/2, Balaji
 Industrial Park, Behind Hindalco Co. MIDC Taloja, Panvel, Dist. Raigad",200.0,bombayrecyclers@gmail.c om,9821174239,Dismantler
"Hari Om Scrap Traders, 957/43, K.P. 2nd Lane, S. P. Road, Opp. Om Namahshivaya Bldg. Mumbai
 Central, Mumbai",49.5,hariomscrap@gmail.com,9820135742,Dismantler
"Go Green Recycling, Unit No. 75/66, Hasti Industrial Estate, TTC Industrial Area, Mahape, Navi
 Mumbai",150.0,gogreenrecyclingindia@g mail.co m,9892859959,Dismantler
"New India Scrap Traders, Plot No. 31/E, Ashok Nagar, Dist.
 Aurangabad",150.0,newindia95@gmail.com,9545950000,Dismantler
"Navkar Recycling, Sr. No. 69, Hissa No. 15, Mahamadiya Estate, Mumbai Panvel Road, Post.
 Dahisar, Dist. Thane",1000.0,recycling.navkar@gmail.co m,9987470404,Dismantler
"Harshita Green Recyclers, Gat No.
 452, Urse Talegaon Dhabade, Tal. Maval, Dist. Pune",500.0,harshitagreenrecyclers@g mail.co m,9850205186,Dismantler
"Vora Computers Pvt. Ltd., 1B, Lara Apartments, Sadhu Vaswani Chowk, Hotel Woodland Lane, 1/D/3, Tal. & Dist. Pune",50.0,voracomputers_pl@hotm ail.com,9823582374,Dismantler
"Clean Tech, B/8, Gala No. 3, Parasnath Indl Estate, Anjurphata Road, Village Val, Tal: Bhiwandi
 Dist: Thane",360.0,aashoksing@gmail.com,9892602502,Dismantler
"Green IT Recycling Centre Pvt. Ltd., Gat No. 207, Plot No. 3 & 4, Near Scienunero Company, Near PMT Depot, Shindewadi, Tal. Bhor, Dist.
 Pune",1000.0,"rth_raj@hotmail.com
 avis.tech@rediffmail.com",9822356062,Dismantler
"Bhavesh Enterprises, Sr. No. 225/11, Hissa No. 23, Gausiya Compound, Gate No. 1, Vill. Pimpri,
 Tal. & Dist. Thane",200.0,thoufise.11@gmail.com,9987263156,Dismantler
"Om Recycling, 19/2, Mangalwa
 Peth,19/2 mangalwar peth pune., Peth, Dist. Pune",100.0,omrecycling@gmail.com,9850205186,Dismantler
"Process Recycling, Gala No,2, S. No 302, Richard Compound Near Maharashtra Vajan Kata, Umang pharma road vasai phata, Dist.
 Palghar",125.0,san.karande1@gmail.com,7757967675,Dismantler
"New Shivam Enteprises, Gala No.
 326, At. Post. Khandale, Near Suruchi Dairy, Dist. Pune",4800.0,csashishbhadade@gmail.c om,7066904939,Dismantler
"Mahesh Traders, Plot No. 316, Shree Shahu Market Yard, Tal. Karveer, Dist. Kolhapur",107.0,"maheshchetiwal11@gmail
 .com",9823901011,Dismantler
"Manihar Enterprises, Survey No.
 74, Village Goteghar, Tal. Thane, Dist. Thane",1000.0,shamimmanihar7@gmail.c om,9326135646,Dismantler
"Asquare Industrial Solutions, Gala No. 3, Plot No. 35, Mulgaon, MIDC Khopoli, Tal. Khopoli, Dist. Raigad",300.0,asquare1516@gmail.com,9860034557,Dismantler
"Map Trading Company, Gat No.
 670, Villoli, Tal. & Dist. Nashik 422010",500.0,abhi26mish@gmail.com,9028155357,Dismantler
"Environment Experts, Gala No. 11, Lane, J. K. Compound, Opp. Roshan Comp. Kherani Road, Sakinaka,
 Mumbai",350.0,abhi26mish@gmail.com,90281553570,Dismantler
"Green Enviro Services, 118/1,
 Wasali, Tal. Khed, Dist. Pune",700.0,"greenenviropune@gmail.c
 om",9604991177,Dismantler
"Bsqaure E-Waste Recyclers, Gala No. 800, Survey No. 69/3, Siddhivinayak Market, Mohammadia Estate, Pimpri, Thane, Dist: Thane, Maharashtra.",325.0,bdwadde501@gmail.com,9920440149,Dismantler
"SK E-Waste Disposal, Gat No. 116, Fine Weight Bridge, Jadhavwadi, Chikhali, Tal: Haveli, Dist: Pune.",250.0,shadiqkhan50@gmail.com,9766696298,Dismantler
"Mahalaxmi E- Recyclers Pvt. Ltd. Plot No.77 & 78, Subplot No. 3A, Ramtekdi Industrial Area, Hadapsar, Tal. Haveli, Dist. Pune",525.0,mpmehta_2000@yahoo.c om,7276411826,Dismantler
"Kapila Enterprises, Gat No. 46/3,
 At. Post. Supa, Tal. Parner, Dist: Ahmednagar",250.0,kapilaentarprises2482@g mail.co m,9762803306,Dismantler
"Aqsa Stamping, Plot no. 55, Rangara Industrial Estate, 33/35, Kiravali (Adivali), Tal. Panvel, Dist.
 Raigad.",300.0,"aqsastamping@rocketmail
 .com",9820026815,Dismantler
"CPG Shell Mould & Casting, Plot No. W- 39, Additional MIDC, Satara",1000.0,cpgshell@gmail.com,9822777706,Dismantler
"Rolex Entrprises, Survey No. 218,
 Hissa No. 4/1, Dahisar, Navi Mumbai",500.0,rolex2030@gmail.com,9820072030,Dismantler
"Eco Tech Recycling, C/6, (5), Sagar Industrial Estate, S. No. 46/4, Dhumal Nagar, Vasai (E), Tal: Vasai,
 Dist: Palghar.",450.0,saiprasad.anavkar@gmail. com,9664998192,Dismantler
"R T Corporation, S.No.377, H.No.2, Ambisi Ganeshpuri Road, Village- Palsai, Tal: Wada, Dist-Palghar.",3000.0,rtc.iqbal@gmail.com,9324525208,Dismantler
"Ecostar Recycling, Survey No.94 Hissa No.12 Mahadev Industrial, Near Ladi Company, Mumbra, Dist:
 Thane-400612.",275.0,recyclingecostar@gmail.co m,9969425168,Dismantler
"Bombay Metal Works, Sr. 54, Hissa
 No. 4, Dahisar Road, Pimpri, Tal & Dist: Thane",1000.0,bombay.mw@gmail.com,9820047496,Dismantler
"Ancus India Reprocessing Pvt. Ltd., shop No. 2, Bldg. No. 1, Tiwari Estate, Village Dhaniv, Nalasopara (E), Vasai",450.0,ancusindia@gmail.com,9594285656,Dismantler
"Progressive Recycler LLP. MIDC
 Chakan Industrial area (PH-II), D-45, Tal. Khed, Dist:-Pune",295.0,progressiverecycler@gmai l.com,9601262269,Dismantler
"Envirocare Recycling Pvt. Ltd., Unit no: 8/ C-I Actual Industrial Complex, Uchat, Road, Village Magathane, Tal. Wada Dist. Thane",500.0,info@envirocareindia.co.i n,9820094450,Dismantler
"Green Planet Recycling Solutions, Sr. No. 72/1/A, At Bhandarli, Dahisar Mori, Old Mumbra Panvel Road, Tal. & Dist. Thane",550.0,info@greenrecycle.in,7666562225,Dismantler
"A. S. Enterprises, Shop No. 4 Shankar Temple, Jasmine Bldg. Pestam Sagar Road No. 4, Chembur, Mumbai Suburban -
 400089",500.0,"as.enterprises9090@gmail
 .com",-,Dismantler
"Rcube Recycling Pvt Ltd., Shree Ganesh Indl Estate, Vasai, Palghat, Khairpada, Palghar - 401330",230.0,info@rcuberecycling.com,8369684193,Dismantler
"Alfa Trading Co., KOLHAPUR ESTATE, YADAV NAGAR, KHERANI
 ROAD, SAKINAKA, Andheri, Mumbai Suburban - 400072",80.0,alfatradingcomp@gmail.c om,9967665574,Dismantler
"Universal Waste Management, Gala No. B-10, D. P. K. Compound,
 Khairani Road, Sakinaka, Mumbai –
 400072 - 400072",310.0,snadeemalvi@gmail.com,8692005752,Dismantler
"Sadab Traders, Plot No. 1154, Gat No. 140/2A/1, Village Vilholi, Behind Jain Temple, Tal & Dist.
 Nashik - 422010",300.0,sadabtra.nsk@gmail.com,9372670601,Dismantler
"GNG Electronics Pvt. Ltd., Sr. No.
 54, Hissa No. Dahisar Rd, Pimpri, Tal. & Dist. - Thane",750.0,"vipul.g@electronicsbazaar
 .com",7667568801,Dismantler
"ARSH RECYCLING PRIVATE LIMITED, GAT No. 1750, RANJANGAON GANPATI, PUNE NAGAR ROAD,
 Ranjangaon Ganpati, Pune - 412209",2400.0,arshrecycling4@gmail.co m,7040691499,Dismantler
"SAHARA ENTERPRISES, GAT N0 65 DEHU ALANDI ROAD, CHIKHALI, TAL.HAVELI DIST.PUNE - 411062",160.0,irfan2068@gmail.com,9821761541,Dismantler
"Anand Computer System, 2160 B, Sadashiv Peth, Swamipuram Bldg, Shop No. 7,8,9, Pune - 411030",350.0,anandcomputer2000@yah oo.com-,9371015373,Dismantler
"Bharat E Waste Recycling Co., Sr. No. 189, Vill. Waliv, Vasai-Virar City (M Corp), Palghar - 401208.",500.0,"info@bharatewaste.com
 info@ewastemart.com",9224757187,Dismantler
"Chaudhary Metal. 80/2, Village - Waliwali Dahisar, Mori, Mumbra Panvel Road, Group Grampanchayat, Dist. Thane -
 400612",350.0,chaudharymatel123@gma il.com,9167924507,Dismantler
"E Clean E Green Recycling, Umar Compound, Jabar Pada, Nalasopara, Vasai-Virar City (M Corp), Dist.
 Palghar 401208.",500.0,gaustechcomputers786@g mail.com,9920977276,Dismantler
"Earth Sense Recycle Pvt. Ltd., A7, Gala No.1,2 & 3, Ground Floor, Prerana Complex, Val Village, Dapoda Road, Anjurphatta, Bhiwandi, District-Thane.",750.0,ewastemumbai@earthsen se.in,7738389404,Dismantler
"Regreen Recycling, Flt 205, Pocket 5, Ganeshwadi CHS Ltd, Bldg. 5, Bhimnagar, MIDC Andheri (E), Mumbai Suburban - 400093",120.0,info@regreenrecycling.co m,9819787816,Dismantler
"Solapur Econ Recyfine, Plot No. K- 47 MIDC Chincholi, Tal. Mohol
 Chincholikati, Solapur – 413255",750.0,solapureconrecyfine21@g mail.com,9763034875,Dismantler
"Greenscape Eco Management Private Limited, MIDC Chakan Industrial Area (Ph-II), Pune -
 410501",900.0,rupesh@greenscape- eco.com,7558426313,Dismantler
"Krishna Metal Refinery, Plot No.1- 2/143, Sapronde Village, Taluka - Wada, District- Thane - 400086",750.0,krishnarefinery@gmail.co m,9323901533,Dismantler
"Kuldeep E-Waste Disposals, Sr. No. 50, Waghjainagar, Mabegaon Khurd, Katraj- Ambegaon Road,
 Katraj, Pune - 411046",90.0,"sagarscrap@gmail.com
 jayant@connectinfosol.co m",9850289885,Dismantler
"Mac Fix Station, Office No. 201, Makhija Arcade, 35th Road, Khar Bandra Linking Road, Bandra,
 Mumbai Suburban - 400052",800.0,skasim11@gmail.com,8879765306,Dismantler
"Manish Metal, Gat No 925, Near
 Ashtekar Bangla, A/P- Theur, Dist- Pune - 412110",550.0,"manish.metal5050@gmail
 .com",9850059804,Dismantler
"S.K. Enterprises, Plot No: 134 Paiki Sub Plot No.- 1, Ahmednagar Industrial Estate Co-Op. Society Ltd, Nagpur-Pune Road, Ta & Dist - Ahmedanagar-414005.",5000.0,skeprocessorsindia@yaho o.com,9422232332,Dismantler
"BKE RECYCLING, Adsul Mala, Shivram Nagar, Uruli Devachi, Uruli Devachi, Pune - 412308",300.0,bkerecycling@gmail.com,9764279786,Dismantler
"Nagraj E-Waste Recycling, S.No.41 Vill Asoli Mouza Mahalgaon Tah Kamptee Dist Nagpur - 441202",1800.0,nagrajewaste@gmail.com,9595105301,Dismantler
"New Ecotech Recycling, Survey no. 136, Hissa no. 364, At Post - Khaniwade, Taluka -Vasai, District. Palghar-401305.",300.0,newecotechrecycling@gm ail.com,9096088943,Dismantler
"R.K.E-Recycling International LLP Gala no.-2, Tirupati Industrial Park, Sativali Road, Vasai East- 401208",130.0,info@rkrecycle.com,9004211892,Dismantler
